<?xml version="1.0" encoding="UTF-8"?>
<dataroot xmlns:od="urn:schemas-microsoft-com:officedata" xmlns:xsi="http://www.w3.org/2001/XMLSchema-instance"  xsi:noNamespaceSchemaLocation="_RELATION_Werke-Orte.xsd" generated="2023-05-21T18:32:06">
<_x002A_RELATION_Werke-Orte>
<ID>1</ID>
<Werk>2</Werk>
<Beziehung>2</Beziehung>
<Ort>1</Ort>
</_x002A_RELATION_Werke-Orte>
<_x002A_RELATION_Werke-Orte>
<ID>2</ID>
<Werk>2</Werk>
<Beziehung>2</Beziehung>
<Ort>1</Ort>
</_x002A_RELATION_Werke-Orte>
</dataroot>
